{
  "name": "Karan Sandhu",
  "email": "sandhukaran2821@gmail.com",
  "phone": "",
  "address": "",
  "linkedin": "linkedin.com/in/karan-sandhu28",
  "summary": "",
  "experience": [],
  "education": [
    {
      "institution": "",
      "degree": "Master of Information Technology",
      "period": "",
      "details": [
        "Queensland University of Technology"
      ]
    },
    {
      "institution": "02/ - 12/2025  Bris",
      "degree": "bane, QLD, Australia",
      "period": "2024",
      "details": []
    },
    {
      "institution": "",
      "degree": "Bachelor of Computer Science &",
      "period": "",
      "details": [
        "Engineering",
        "Chitkara Institute of Engineering and",
        "Technology, Punjab, India"
      ]
    },
    {
      "institution": "07/ - 05/2023  6.9 GPA",
      "degree": "",
      "period": "2019",
      "details": []
    }
  ],
  "skills": [
    "ReactJS Angular Typescript React Native",
    "Material UI Bootstrap HTML CSS JS",
    "NodeJS MongoDB ExpressJS Java C#",
    "Flutter Git SQL Firebase Postman",
    "PROJECTS",
    "Ecommerce Shipping Solution (03/2023 - 02/2024)",
    "Developed a Canadian Angular web application for international",
    "shipping.",
    "Handled live customer queries and resolved issues.",
    "Realtime Flood Alert & Management System",
    "(02/2022 - 03/2023)",
    "Developed the frontend for web and mobile application using",
    "React and React Native .",
    "Realtime video",
    "audio & content management system",
    "(05/2022 - 09/2022)",
    "Developed the frontend for a React web app used in the Middle",
    "East.",
    "Ecommerce Web Application (03/2022 - 05/2022)",
    "Worked as a front-end developer in this Europe based react",
    "webapp.",
    "Grabhub- food Order Web App (12/2022 - 02/2022)",
    "Designed and developed a full-stack food ordering application",
    "using NodeJS and MongoDB.",
    "HONOURS AND AWARDS",
    "Core value award for \"Learning\" (09/2022)",
    "Recognized at RMgX for continuous learning and growth.",
    "Rising Star Award of 2022 (12/2022)",
    "Awarded for exceptional ownership and performance at RMgX.",
    "REFERENCES",
    "Available on request",
    "Achievements/Tasks",
    "Achievements/Tasks",
    "Achievements/Tasks"
  ],
  "languages": [],
  "certifications": [],
  "verificationResults": {
    "missingContent": [
      "Karan Sandhu \nStudent At QUT \nInnovative software developer with expertise in full-stack\ndevelopment, specializing in modern frontend technologies. Skilled in\nUI/UX optimization, performance-driven solutions, and scalable\napplication design. \nsandhukaran2821@gmail.com \n+61 450 906 076 \nBrisbane, Australia \nlinkedin.com/in/karan-sandhu28 \ngithub.com/sandhukaran28 \nWORK EXPERIENCE \nAssociate I - Technology \nRMgx Technologies LLP \n02/2023 - 02/2024,  Gurugram, India \nDeveloped and optimized frontend features for various web\napplications. \nCollaborated with UX and BA teams to refine requirements\nand UI designs. \nResolved customer issues and provided efficient technical\nsolutions. \nWeb Developer Intern \nRMgx Technologies LLP \n05/2022 - 01/2023,  Gurugram, India \nDesigned, developed, and maintained websites for both in-\nhouse and client projects. \nOptimized website performance and improved load times\nthrough efficient coding practices. \nAssisted in debugging and troubleshooting web applications\nto enhance user experience. \nSDE Intern \nGuenstiger India Pvt Ltd \n03/2022 - 05/2022,  Gurugram, India \nDeveloped responsive web interfaces using HTML, CSS, and\nJavaScript. \nEnhanced user experience through performance\noptimization and collaboration with cross-functional teams. \nEDUCATION \nMaster of Information Technology \nQueensland University of Technology \n02/2024 - 12/2025,  Brisbane, QLD, Australia \nBachelor of Computer Science &\nEngineering \nChitkara Institute of Engineering and\nTechnology, Punjab, India \n07/2019 - 05/2023,  6.9 GPA \nSKILLS \nReactJS Angular Typescript React Native \nMaterial UI Bootstrap HTML CSS JS \nNodeJS MongoDB ExpressJS Java C# \nFlutter Git SQL Firebase Postman \nPROJECTS \nEcommerce Shipping Solution (03/2023 - 02/2024) \nDeveloped a Canadian Angular web application for international\nshipping. \nHandled live customer queries and resolved issues. \nRealtime Flood Alert & Management System\n (02/2022 - 03/2023) \nDeveloped the frontend for web and mobile application using\nReact and React Native . \nRealtime video, audio & content management system\n (05/2022 - 09/2022) \nDeveloped the frontend for a React web app used in the Middle\nEast. \nEcommerce Web Application (03/2022 - 05/2022) \nWorked as a front-end developer in this Europe based react\nwebapp. \nGrabhub- food Order Web App (12/2022 - 02/2022) \nDesigned and developed a full-stack food ordering application\nusing NodeJS and MongoDB. \nHONOURS AND AWARDS \nCore value award for \"Learning\" (09/2022) \nRecognized at RMgX for continuous learning and growth. \nRising Star Award of 2022 (12/2022) \nAwarded for exceptional ownership and performance at RMgX. \nREFERENCES \nAvailable on request \nAchievements/Tasks \nAchievements/Tasks \nAchievements/Tasks"
    ],
    "coveragePercentage": 0
  }
}